{
  "id": "sample-013",
  "name": "Positioned Overlap Complex",
  "category": "fidelity",
  "pages": [
    {
      "id": "p1",
      "elements": [
        {
          "id": "hero-bg",
          "type": "image",
          "x": 72,
          "y": 88,
          "width": 380,
          "height": 220,
          "content": "data:image/png;base64,iVBORw0KGgoAAAANSUhEUgAAAAEAAAABCAQAAAC1HAwCAAAAC0lEQVR42mP8/x8AAwMCAO2F6bkAAAAASUVORK5CYII=",
          "fitMode": "cover",
          "style": { "zIndex": 1 }
        },
        {
          "id": "hero-title",
          "type": "text",
          "x": 92,
          "y": 110,
          "width": 340,
          "height": 48,
          "content": "Quarterly Revenue Brief",
          "style": { "fontSize": 24, "fontWeight": "bold", "color": "#0f172a", "zIndex": 3 }
        },
        {
          "id": "hero-sub",
          "type": "richtext",
          "x": 92,
          "y": 166,
          "width": 320,
          "height": 100,
          "htmlContent": "<p><strong>Highlights:</strong> Growth remains stable across all regions.</p><p><span style=\"color:#1d4ed8\">North America +8.4%</span> and <span style=\"color:#047857\">EMEA +6.1%</span>.</p>",
          "style": { "fontSize": 12, "lineHeight": 1.35, "color": "#1f2937", "zIndex": 4 }
        },
        {
          "id": "overlay-note",
          "type": "note",
          "x": 330,
          "y": 250,
          "width": 200,
          "height": 120,
          "noteTitle": "Action",
          "noteBody": "Prioritize retention campaigns in regions with slower momentum.",
          "style": { "backgroundColor": "#fde68a", "zIndex": 5 }
        },
        {
          "id": "table-1",
          "type": "table",
          "x": 72,
          "y": 360,
          "width": 458,
          "height": 180,
          "headerRow": true,
          "columnWidths": [ 190, 140, 128 ],
          "columnAlignments": [ "left", "right", "right" ],
          "cellData": [
            ["Region", "Q1", "Q2"],
            ["North America", "12.4M", "13.4M"],
            ["EMEA", "9.2M", "9.8M"],
            ["APAC", "8.5M", "8.9M"]
          ],
          "style": { "borderWidth": 1, "borderColor": "#334155" }
        }
      ]
    }
  ],
  "sharedElements": [],
  "pageSettings": { "width": 595, "height": 842, "orientation": "portrait" }
}